{
  "$schema": "https://json-schema.org/draft/2020-12/schema",
  "title": "controlled-contract-test-execution-profile.v1",
  "description": "Closed definition of the existing authenticated test-execution mechanism. It establishes execution validity and no assertion-to-requirement adequacy. Graph-pattern profiles retain their own schema.",
  "type": "object",
  "additionalProperties": false,
  "required": [
    "schema_version",
    "profile_id",
    "profile_version",
    "contract_schema_version",
    "vocabulary_version",
    "vocabulary_signature_digest",
    "vocabulary_algebra_digest",
    "vocabulary_definitions_digest",
    "vocabulary_complete_digest",
    "verification_falsifier_policy",
    "reference_roles",
    "number_roles",
    "distinct_reference_role_sets",
    "reference_binding_patterns",
    "reference_role_count_bindings",
    "binding_constraint_patterns",
    "claim_patterns",
    "relation_patterns",
    "collection_patterns",
    "resolver_fact_patterns",
    "evidence_patterns",
    "falsifier_condition_bindings",
    "falsifier_occurrence_bindings",
    "stable_capabilities",
    "satisfaction_expression"
  ],
  "properties": {
    "schema_version": {
      "const": "controlled-contract-test-execution-profile.v1"
    },
    "profile_id": {
      "const": "proof.verification.test-validity"
    },
    "profile_version": {
      "type": "string",
      "pattern": "^[0-9]+\\.[0-9]+\\.[0-9]+$"
    },
    "contract_schema_version": {
      "const": "controlled-acceptance-contract.v1"
    },
    "vocabulary_version": {
      "const": "controlled-contract-vocabulary.v1"
    },
    "vocabulary_signature_digest": {
      "const": "611641e41afa46ea0bace9e8a98e31596a59f9109c32c354d2cdf5656790e571"
    },
    "vocabulary_algebra_digest": {
      "const": "47f6cca501c1784760333daf235ae1dc7c512971f7ed54ae0a923f404b9b7d1b"
    },
    "vocabulary_definitions_digest": {
      "const": "10a7964948bfc8323ac7636047034c17db75af05168f6f242afb12e2f6bf4d38"
    },
    "vocabulary_complete_digest": {
      "const": "e7b23dee357a5893f14e931905c736d42442b47debbf713aaef88afeb16184af"
    },
    "verification_falsifier_policy": {
      "const": "controlled_complement_per_target"
    },
    "reference_roles": {
      "const": []
    },
    "number_roles": {
      "const": []
    },
    "distinct_reference_role_sets": {
      "const": []
    },
    "reference_binding_patterns": {
      "const": []
    },
    "reference_role_count_bindings": {
      "const": []
    },
    "binding_constraint_patterns": {
      "const": []
    },
    "claim_patterns": {
      "const": []
    },
    "relation_patterns": {
      "const": []
    },
    "collection_patterns": {
      "const": []
    },
    "resolver_fact_patterns": {
      "const": []
    },
    "evidence_patterns": {
      "const": []
    },
    "falsifier_condition_bindings": {
      "const": []
    },
    "falsifier_occurrence_bindings": {
      "const": []
    },
    "stable_capabilities": {
      "const": {
        "semantic_mechanisms": [],
        "test_validity": "provider_bound_test_validity.v1"
      }
    },
    "satisfaction_expression": {
      "const": {
        "authenticated_test_execution": {
          "semantic_facts_schema": "controlled-contract-test-proof-semantic-facts.v1",
          "evaluator_id": "proof.verification.test-validity.execution-evaluator",
          "behavioral_adequacy": "not_established"
        }
      }
    }
  }
}
