{
  "schema_version": "controlled-contract-test-execution-profile.v1",
  "profile_id": "proof.verification.test-validity",
  "profile_version": "12.0.0",
  "contract_schema_version": "controlled-acceptance-contract.v1",
  "vocabulary_version": "controlled-contract-vocabulary.v1",
  "vocabulary_signature_digest": "611641e41afa46ea0bace9e8a98e31596a59f9109c32c354d2cdf5656790e571",
  "vocabulary_algebra_digest": "47f6cca501c1784760333daf235ae1dc7c512971f7ed54ae0a923f404b9b7d1b",
  "vocabulary_definitions_digest": "10a7964948bfc8323ac7636047034c17db75af05168f6f242afb12e2f6bf4d38",
  "vocabulary_complete_digest": "e7b23dee357a5893f14e931905c736d42442b47debbf713aaef88afeb16184af",
  "verification_falsifier_policy": "controlled_complement_per_target",
  "reference_roles": [],
  "number_roles": [],
  "distinct_reference_role_sets": [],
  "reference_binding_patterns": [],
  "reference_role_count_bindings": [],
  "binding_constraint_patterns": [],
  "claim_patterns": [],
  "relation_patterns": [],
  "collection_patterns": [],
  "resolver_fact_patterns": [],
  "evidence_patterns": [],
  "falsifier_condition_bindings": [],
  "falsifier_occurrence_bindings": [],
  "stable_capabilities": {
    "semantic_mechanisms": [],
    "test_validity": "provider_bound_test_validity.v1"
  },
  "satisfaction_expression": {
    "authenticated_test_execution": {
      "semantic_facts_schema": "controlled-contract-test-proof-semantic-facts.v1",
      "evaluator_id": "proof.verification.test-validity.execution-evaluator",
      "behavioral_adequacy": "not_established"
    }
  }
}
